{
  "candidates": [
    {
      "advisory_only": true,
      "can_promote_truth": false,
      "candidate_id": "recursive_transfer_replay_candidate",
      "candidate_type": "recursive_transfer_replay_candidate",
      "descension_target": "replay_validation",
      "description": "Use reported compact route-memory results to propose a bounded replay comparison.",
      "duplicate_risk": 0.25,
      "expected_bridge_value": 0.35,
      "expected_certificate_value": 0.25,
      "expected_constructor_reuse": 0.918333334,
      "expected_obstruction_value": 0.35,
      "expected_residual_compression": 0.75,
      "notes": "Reported historical metrics and route scores are advisory only; not terminal truth, not a certificate, and cannot promote VERIFIED_PROOF.",
      "novelty_score": 0.35,
      "source_ids": [
        "metrics",
        "source_summary",
        "report"
      ],
      "suggested_route": "frozen evidence replay and route-memory comparison",
      "title": "Recursive residual transfer replay validation",
      "verification_cost": 0.25
    }
  ],
  "policy": {
    "beta": 1,
    "mode": "balanced"
  },
  "reported_metrics": [
    {
      "name": "compact_transfer_gain_vs_generic_positive",
      "source_id": "metrics",
      "value": 234.166667
    },
    {
      "name": "compact_retains_recursive_gain",
      "source_id": "metrics",
      "value": 0.989575
    },
    {
      "name": "compact_prunes_recursive_memory",
      "source_id": "metrics",
      "value": 0.53
    },
    {
      "name": "generic_mean_recoveries",
      "source_id": "metrics",
      "value": 11405.5
    },
    {
      "name": "true_contamination_max",
      "source_id": "metrics",
      "value": 0
    },
    {
      "name": "all_gates_pass",
      "source_id": "metrics",
      "value": true
    },
    {
      "name": "advisory_boundary_ok",
      "source_id": "metrics",
      "value": true
    }
  ],
  "request_id": "recursive_residual_transfer_v1_20260523:discover-v1",
  "schema_version": "mathgraph.discover-request.v1",
  "source_diagnostics": [
    "HISTORICAL_RESULTS_ADVISORY: experiment not rerun or authenticated; local hashes establish byte identity only.",
    "MISSING_LOCAL_ARTIFACT: candidate_generation_scores_full",
    "MISSING_LOCAL_ARTIFACT: sqlite_ledger",
    "FULL_REPLAY_UNAVAILABLE: sqlite_ledger",
    "MISSING_EXPECTED_ARTIFACT: codex_manifest.json",
    "MISSING_EXPECTED_ARTIFACT: discovery_summary.json",
    "MISSING_EXPECTED_ARTIFACT: loose README.md",
    "MISSING_EXPECTED_ARTIFACT: compact_atlas_eval.csv",
    "MISSING_EXPECTED_ARTIFACT: repo_vs_original_comparison.json",
    "MISSING_EXPECTED_ARTIFACT: repo_vs_original_comparison.md",
    "MISSING_EXPECTED_ARTIFACT: frozen_evidence_comparison.json",
    "FULL_REPLAY_NOT_PERFORMED: original equations, matrix, toolchain and replay inputs are not qualified by this adapter."
  ],
  "sources": [
    {
      "availability": "PRESENT",
      "bundle": null,
      "bundle_relative_path": null,
      "integrity_check": "MATCHED",
      "locator": "examples/evidence_packs/recursive_residual_transfer_v1_20260523/manifest.json",
      "repo_path": "examples/evidence_packs/recursive_residual_transfer_v1_20260523/manifest.json",
      "required_for_full_replay": false,
      "sha256": "449e9f9378a90ffb975f21cd5d534455f0d03bc393bf821daefdc000950509c5",
      "size_bytes": 13149,
      "source_id": "manifest"
    },
    {
      "availability": "PRESENT",
      "bundle": null,
      "bundle_relative_path": null,
      "integrity_check": "MATCHED",
      "locator": "examples/evidence_packs/recursive_residual_transfer_v1_20260523/metrics.json",
      "repo_path": "examples/evidence_packs/recursive_residual_transfer_v1_20260523/metrics.json",
      "required_for_full_replay": false,
      "sha256": "83c9a568d2fc3f9c06bd4487c51a7a6af1ba44323a33e6b3e3b86e23d1bf0b2c",
      "size_bytes": 1483,
      "source_id": "metrics"
    },
    {
      "availability": "PRESENT",
      "bundle": "codex_breakthrough_artifact_bundle.zip",
      "bundle_relative_path": "files/drive__MyDrive__MathGraph_ETP_Recursive_Transfer_v1__mathgraph_recursive_residual_transfer_v1_transfer_fast_20260523_055739__recursive_transfer_summary.json",
      "integrity_check": "MATCHED",
      "locator": "/content/drive/MyDrive/MathGraph_ETP_Recursive_Transfer_v1/mathgraph_recursive_residual_transfer_v1_transfer_fast_20260523_055739/recursive_transfer_summary.json",
      "repo_path": "examples/evidence_packs/recursive_residual_transfer_v1_20260523/source_artifacts/drive__MyDrive__MathGraph_ETP_Recursive_Transfer_v1__mathgraph_recursive_residual_transfer_v1_transfer_fast_20260523_055739__recursive_transfer_summary.json",
      "required_for_full_replay": false,
      "sha256": "7c554b771261651a43b3b4dacd51e20bb63e6124c8130fe1f45f13453b48ac1a",
      "size_bytes": 643,
      "source_id": "source_summary"
    },
    {
      "availability": "PRESENT",
      "bundle": "codex_breakthrough_artifact_bundle.zip",
      "bundle_relative_path": "files/drive__MyDrive__MathGraph_ETP_Recursive_Transfer_v1__mathgraph_recursive_residual_transfer_v1_transfer_fast_20260523_055739__gate_results.csv",
      "integrity_check": "MATCHED",
      "locator": "/content/drive/MyDrive/MathGraph_ETP_Recursive_Transfer_v1/mathgraph_recursive_residual_transfer_v1_transfer_fast_20260523_055739/gate_results.csv",
      "repo_path": "examples/evidence_packs/recursive_residual_transfer_v1_20260523/source_artifacts/drive__MyDrive__MathGraph_ETP_Recursive_Transfer_v1__mathgraph_recursive_residual_transfer_v1_transfer_fast_20260523_055739__gate_results.csv",
      "required_for_full_replay": false,
      "sha256": "195f17d394125df425b3cd8481d3121886534474996ea5943f83bbbb6fa78869",
      "size_bytes": 530,
      "source_id": "gate_results"
    },
    {
      "availability": "PRESENT",
      "bundle": "codex_breakthrough_artifact_bundle.zip",
      "bundle_relative_path": "files/drive__MyDrive__MathGraph_ETP_Recursive_Transfer_v1__mathgraph_recursive_residual_transfer_v1_transfer_fast_20260523_055739__route_summary.csv",
      "integrity_check": "MATCHED",
      "locator": "/content/drive/MyDrive/MathGraph_ETP_Recursive_Transfer_v1/mathgraph_recursive_residual_transfer_v1_transfer_fast_20260523_055739/route_summary.csv",
      "repo_path": "examples/evidence_packs/recursive_residual_transfer_v1_20260523/source_artifacts/drive__MyDrive__MathGraph_ETP_Recursive_Transfer_v1__mathgraph_recursive_residual_transfer_v1_transfer_fast_20260523_055739__route_summary.csv",
      "required_for_full_replay": false,
      "sha256": "b9c6b402297194dfa687361d8bb5171a311f291b77e0f56c59fe5bba693fab4e",
      "size_bytes": 2508,
      "source_id": "route_summary"
    },
    {
      "availability": "PRESENT",
      "bundle": "codex_breakthrough_artifact_bundle.zip",
      "bundle_relative_path": "files/drive__MyDrive__MathGraph_ETP_Recursive_Transfer_v1__mathgraph_recursive_residual_transfer_v1_transfer_fast_20260523_055739__best_compact_by_seed_split.csv",
      "integrity_check": "MATCHED",
      "locator": "/content/drive/MyDrive/MathGraph_ETP_Recursive_Transfer_v1/mathgraph_recursive_residual_transfer_v1_transfer_fast_20260523_055739/best_compact_by_seed_split.csv",
      "repo_path": "examples/evidence_packs/recursive_residual_transfer_v1_20260523/source_artifacts/drive__MyDrive__MathGraph_ETP_Recursive_Transfer_v1__mathgraph_recursive_residual_transfer_v1_transfer_fast_20260523_055739__best_compact_by_seed_split.csv",
      "required_for_full_replay": false,
      "sha256": "3530b5667324d22154fdec43068c7104e8492ded5603f5d5bf66f37921750f5a",
      "size_bytes": 1585,
      "source_id": "compact_atlas_selection"
    },
    {
      "availability": "PRESENT",
      "bundle": "codex_breakthrough_artifact_bundle.zip",
      "bundle_relative_path": "files/drive__MyDrive__MathGraph_ETP_Recursive_Transfer_v1__mathgraph_recursive_residual_transfer_v1_transfer_fast_20260523_055739__generation_summary.csv",
      "integrity_check": "MATCHED",
      "locator": "/content/drive/MyDrive/MathGraph_ETP_Recursive_Transfer_v1/mathgraph_recursive_residual_transfer_v1_transfer_fast_20260523_055739/generation_summary.csv",
      "repo_path": "examples/evidence_packs/recursive_residual_transfer_v1_20260523/source_artifacts/drive__MyDrive__MathGraph_ETP_Recursive_Transfer_v1__mathgraph_recursive_residual_transfer_v1_transfer_fast_20260523_055739__generation_summary.csv",
      "required_for_full_replay": false,
      "sha256": "1c9630ada5634816005a95fedeeae4670e0c8a5a926770cf3a6c0233902bc65f",
      "size_bytes": 2568,
      "source_id": "generation_summary"
    },
    {
      "availability": "PRESENT",
      "bundle": "codex_breakthrough_artifact_bundle.zip",
      "bundle_relative_path": "files/drive__MyDrive__MathGraph_ETP_Recursive_Transfer_v1__mathgraph_recursive_residual_transfer_v1_transfer_fast_20260523_055739__constructor_manifest.csv",
      "integrity_check": "MATCHED",
      "locator": "/content/drive/MyDrive/MathGraph_ETP_Recursive_Transfer_v1/mathgraph_recursive_residual_transfer_v1_transfer_fast_20260523_055739/constructor_manifest.csv",
      "repo_path": "examples/evidence_packs/recursive_residual_transfer_v1_20260523/source_artifacts/drive__MyDrive__MathGraph_ETP_Recursive_Transfer_v1__mathgraph_recursive_residual_transfer_v1_transfer_fast_20260523_055739__constructor_manifest.csv",
      "required_for_full_replay": false,
      "sha256": "ba44a9ee9fad30069f193d81385f01a2d86b8d36e4568a32d3a2ccd15b68ea00",
      "size_bytes": 20510,
      "source_id": "constructor_manifest"
    },
    {
      "availability": "PRESENT",
      "bundle": "codex_breakthrough_artifact_bundle.zip",
      "bundle_relative_path": "files/drive__MyDrive__MathGraph_ETP_Recursive_Transfer_v1__mathgraph_recursive_residual_transfer_v1_transfer_fast_20260523_055739__constructor_attribution.csv",
      "integrity_check": "MATCHED",